{
  "$schema": "https://json-schema.org/draft/2020-12/schema",
  "$id": "https://github.com/pedapudi/foe/blob/main/docs/config.md",
  "title": "foe configuration",
  "description": "The configuration document of one episode. docs/config.md specifies every key; this schema mirrors it. Every path is absolute. No value is read from the environment.",
  "type": "object",
  "additionalProperties": false,
  "required": ["version", "name", "instructions", "tools", "grants", "budget", "task"],
  "properties": {
    "version": {
      "description": "The configuration format version. This schema describes version 2.",
      "const": 2
    },
    "name": {
      "description": "A short name for the program. Shown in the viewer and written into the log. Participates in identity.",
      "type": "string",
      "minLength": 1
    },
    "instructions": { "$ref": "#/$defs/instructions" },
    "tools": { "$ref": "#/$defs/tools" },
    "tool_defs": { "$ref": "#/$defs/tool_defs" },
    "host_tools": { "$ref": "#/$defs/host_tools" },
    "grants": { "$ref": "#/$defs/grants" },
    "budget": { "$ref": "#/$defs/budget" },
    "done_when": { "$ref": "#/$defs/done_when" },
    "context": { "$ref": "#/$defs/context" },
    "model": { "$ref": "#/$defs/model" },
    "sandbox": {
      "description": "Behavior when Landlock is unavailable. The rules themselves are compiled from grants and tool_defs. Does not participate in identity.",
      "type": "object",
      "additionalProperties": false,
      "properties": {
        "mode": { "type": "string", "enum": ["best-effort", "required", "off"], "default": "best-effort" }
      }
    },
    "program_lineage": { "$ref": "#/$defs/program_lineage" },
    "programs": { "$ref": "#/$defs/programs" },
    "workflow": { "$ref": "#/$defs/workflow" },
    "task": {
      "description": "What this episode is to do. Written into the log as the first inbox item. Does not participate in identity.",
      "type": "string",
      "minLength": 1
    }
  },
  "$defs": {
    "model": {
      "description": "When present, foe calls the selected model. At the root, absence delegates model requests to the host process. In a child, absence inherits the nearest ancestor's selection. Every key other than provider, model, and max_output_tokens is a provider-specific string option; docs/models.md lists them. Does not participate in identity.",
      "type": "object",
      "required": ["provider", "model"],
      "properties": {
        "provider": { "description": "A provider name known to the build, such as anthropic, openai, openai-compatible, openrouter, openai-codex, vertex, or exec. foe plan reports an unknown name.", "type": "string", "minLength": 1 },
        "model": { "description": "The model identifier the provider expects.", "type": "string", "minLength": 1 },
        "max_output_tokens": { "description": "Per-request output limit; the default is the provider's.", "type": "integer", "minimum": 1 },
        "api_key_file": { "description": "Absolute path to the API key file; the default is ~/.config/foe/credentials/<provider>.json.", "type": "string", "pattern": "^/" },
        "token_file": { "description": "Absolute path to the OAuth token file; the default is ~/.config/foe/credentials/<provider>.json.", "type": "string", "pattern": "^/" },
        "credentials_file": { "description": "Absolute path to Google credentials; the default is named by ~/.config/foe/credentials/vertex.json.", "type": "string", "pattern": "^/" },
        "base_url": { "description": "Overrides the provider's default endpoint.", "type": "string" },
        "exec": { "description": "Absolute path of the program an exec provider runs.", "type": "string", "pattern": "^/" }
      },
      "additionalProperties": { "type": "string" }
    },
    "instructions": {
      "description": "Section key to section text. Sections render into the system prompt in lexicographic order of their keys. Key and text participate in identity.",
      "type": "object",
      "minProperties": 1,
      "additionalProperties": { "type": "string", "minLength": 1 }
    },
    "tools": {
      "description": "Names of the tools the model may call, in the order their schemas are sent to the model. Each name resolves against the built-in tools, then tool_defs, then host_tools. The order participates in identity.",
      "type": "array",
      "minItems": 1,
      "uniqueItems": true,
      "items": { "type": "string", "minLength": 1 }
    },
    "tool_defs": {
      "description": "Tool name to the executable it runs. Declaring an entry is what permits the episode to execute that file. The executable is hashed into identity by content.",
      "type": "object",
      "additionalProperties": {
        "type": "object",
        "additionalProperties": false,
        "required": ["exec", "description"],
        "properties": {
          "exec": { "description": "Absolute path to the executable.", "type": "string", "pattern": "^/" },
          "description": { "description": "What the tool does and how to call it; sent to the model in the tool schema.", "type": "string", "minLength": 1 },
          "instruction": { "description": "When to use it; appended to the system prompt.", "type": "string" },
          "network": { "description": "Whether the executable may open TCP connections.", "type": "boolean", "default": false },
          "timeout_seconds": { "description": "Wall-clock limit for one invocation.", "type": "integer", "minimum": 1, "default": 120 },
          "cwd": { "description": "Absolute working directory; the default is the first read root.", "type": "string", "pattern": "^/" }
        }
      }
    },
    "host_tools": {
      "description": "Tool name to the specification of a tool the host process implements and answers over the protocol. The specification is in the document so that identity is computable from the document alone.",
      "type": "object",
      "additionalProperties": {
        "type": "object",
        "additionalProperties": false,
        "required": ["description", "params", "effect"],
        "properties": {
          "description": { "description": "Sent to the model in the tool schema.", "type": "string", "minLength": 1 },
          "instruction": { "description": "Appended to the system prompt.", "type": "string" },
          "params": { "description": "JSON Schema for the arguments, in the subset docs/config.md lists.", "type": "object" },
          "effect": { "type": "string", "enum": ["pure", "reads", "writes", "execs", "spawns"] }
        }
      }
    },
    "grants": {
      "description": "What the episode may reach. Paths are absolute directory prefixes, opened once at episode start; every read and write resolves under the open directory. The kinds present and the count of each participate in identity; the paths do not.",
      "type": "object",
      "additionalProperties": false,
      "required": ["read"],
      "properties": {
        "read": { "description": "Absolute directories the episode may read.", "type": "array", "minItems": 1, "items": { "type": "string", "pattern": "^/" } },
        "write": { "description": "Absolute directories the episode may write.", "type": "array", "items": { "type": "string", "pattern": "^/" }, "default": [] },
        "execute": { "description": "Absolute files or directories that subprocesses may read and execute.", "type": "array", "items": { "type": "string", "pattern": "^/" }, "default": [] },
        "spawn": { "description": "Names from programs the episode may start.", "type": "array", "items": { "type": "string", "minLength": 1 }, "default": [] },
        "bind": { "description": "TCP ports a process of the episode may bind.", "type": "array", "items": { "type": "integer", "minimum": 1, "maximum": 65535 }, "default": [] }
      }
    },
    "budget": {
      "description": "Limits for this episode and the whole tree below it. A child's budget is reserved from its parent's remainder.",
      "type": "object",
      "additionalProperties": false,
      "required": ["model_calls"],
      "properties": {
        "model_calls": { "description": "Maximum model requests, including retries.", "type": "integer", "minimum": 1 },
        "input_tokens": { "description": "Maximum provider-reported input tokens across all requests, including cache-read input; unlimited when absent.", "type": "integer", "minimum": 1 },
        "output_tokens": { "description": "Maximum provider-reported output tokens across all requests, including reasoning when the provider includes it; unlimited when absent.", "type": "integer", "minimum": 1 },
        "seconds": { "description": "Wall-clock limit for the episode; unlimited when absent.", "type": "integer", "minimum": 1 },
        "max_depth": { "description": "How many levels of child episodes may exist below this one; 0 forbids spawning.", "type": "integer", "minimum": 0, "default": 1 },
        "max_episodes": { "description": "Lifetime count of episodes in the tree, including this one.", "type": "integer", "minimum": 1, "default": 8 },
        "max_concurrent": { "description": "Children running at once.", "type": "integer", "minimum": 1, "default": 4 },
        "loop_threshold": { "description": "Consecutive identical tool calls, or identical assistant turns, that end the episode as blocked.", "type": "integer", "minimum": 2, "default": 8 }
      }
    },
    "done_when": {
      "description": "When the episode is complete. When absent, the episode completes when the model produces a turn with no tool calls. verify and returns may both be present; the verifier then checks the returned value.",
      "type": "object",
      "additionalProperties": false,
      "properties": {
        "verify": { "description": "Name of a tool in tools; the episode completes when the model finishes and this tool returns no findings.", "type": "string", "minLength": 1 },
        "retries": { "description": "How many times findings are fed back.", "type": "integer", "minimum": 0, "default": 2 },
        "returns": { "description": "A JSON Schema in the subset docs/config.md lists; the episode completes when the model calls the synthesized return tool with a conforming value.", "type": "object" }
      }
    },
    "context": {
      "description": "Whether and when the conversation is compacted: the oldest steps replaced in the model's context by a summary and the runtime's continuation state. docs/compaction.md specifies it. Participates in identity.",
      "type": "object",
      "additionalProperties": false,
      "properties": {
        "compact": { "description": "Whether the runtime compacts the conversation when the projected next request outgrows the model's window.", "type": "boolean", "default": false },
        "window_tokens": { "description": "The model's context window in tokens. Required when compact is true and the provider table does not know the model; must exceed reserve_tokens plus keep_recent_tokens.", "type": "integer", "minimum": 1 },
        "reserve_tokens": { "description": "Tokens kept free below the window; compaction runs when the projected request exceeds window_tokens minus reserve_tokens.", "type": "integer", "minimum": 0, "default": 16384 },
        "keep_recent_tokens": { "description": "Approximate size of the most recent steps kept verbatim after a compaction.", "type": "integer", "minimum": 0, "default": 20000 },
        "margin_tokens": { "description": "Added to the projection of the next request to absorb estimation error.", "type": "integer", "minimum": 0, "default": 2048 }
      }
    },
    "program_lineage": {
      "description": "An ancestry claim relating this program state to a parent state through a content-addressed evidence bundle. Root only. Does not participate in identity. docs/lineage-identity.md specifies the claim and its verification.",
      "type": "object",
      "additionalProperties": false,
      "required": ["parent", "evidence", "verification_log", "verification_seq"],
      "properties": {
        "parent": {
          "type": "object",
          "additionalProperties": false,
          "required": ["program_identity", "state_identity"],
          "properties": {
            "program_identity": { "description": "The parent state's program identity.", "type": "string", "pattern": "^sha256:[0-9a-f]{64}$" },
            "state_identity": { "description": "The parent state's identity, selecting one ancestry claim among those that can accompany a single program identity.", "type": "string", "pattern": "^sha256:[0-9a-f]{64}$" }
          }
        },
        "evidence": { "description": "SHA-256 digest of the evidence bundle's canonical manifest.", "type": "string", "pattern": "^sha256:[0-9a-f]{64}$" },
        "verification_log": { "description": "Bundle-relative path of the episode log holding the authoritative verifier result: forward slashes, no empty, '.', or '..' component.", "type": "string", "minLength": 1 },
        "verification_seq": { "description": "seq of that verification/result event inside verification_log.", "type": "integer", "minimum": 0 }
      }
    },
    "programs": {
      "description": "Program name to a child configuration. A name listed in grants.spawn must appear here. A child's grants must be a subset of its parent's. Each child program's identity participates in the parent's.",
      "type": "object",
      "additionalProperties": { "$ref": "#/$defs/child_program" }
    },
    "child_program": {
      "description": "A full configuration without version, task, or sandbox. An omitted model inherits the nearest ancestor's model.",
      "type": "object",
      "additionalProperties": false,
      "required": ["name", "instructions", "tools", "grants", "budget"],
      "properties": {
        "name": { "type": "string", "minLength": 1 },
        "instructions": { "$ref": "#/$defs/instructions" },
        "tools": { "$ref": "#/$defs/tools" },
        "tool_defs": { "$ref": "#/$defs/tool_defs" },
        "host_tools": { "$ref": "#/$defs/host_tools" },
        "grants": { "$ref": "#/$defs/grants" },
        "budget": { "$ref": "#/$defs/budget" },
        "done_when": { "$ref": "#/$defs/done_when" },
        "context": { "$ref": "#/$defs/context" },
        "model": { "$ref": "#/$defs/model" },
        "programs": { "$ref": "#/$defs/programs" },
        "workflow": { "$ref": "#/$defs/workflow" }
      }
    },
    "workflow": {
      "description": "A declared graph of nodes that replaces the free loop for this episode. docs/workflow.md specifies it. The episode's tools, grants, budget, and done_when are the ceiling every node draws from. A graph whose possible firings exceed 4096 is refused at construction.",
      "type": "object",
      "additionalProperties": false,
      "required": ["nodes"],
      "properties": {
        "nodes": {
          "description": "Node name to node. Exactly one of tool, model, and workflow is set per node.",
          "type": "object",
          "additionalProperties": { "$ref": "#/$defs/workflow_node" }
        },
        "recovery": {
          "type": "object",
          "additionalProperties": false,
          "properties": {
            "enabled": { "description": "Whether a node failure is put to a recovery decision; when false, a failure ends the episode with the node's outcome.", "type": "boolean", "default": true },
            "max_interventions": { "description": "Recovery actions permitted per episode.", "type": "integer", "minimum": 0, "default": 3 }
          }
        }
      }
    },
    "workflow_node": {
      "type": "object",
      "additionalProperties": false,
      "properties": {
        "tool": { "description": "A tool in tools; the node is one call to it.", "type": "string", "minLength": 1 },
        "args": { "description": "The argument object of a tool node. A value { \"$node\": NAME, \"pointer\": POINTER } is replaced by an input node's output, or the value at a JSON Pointer within it.", "type": "object" },
        "model": { "$ref": "#/$defs/child_program" },
        "workflow": { "$ref": "#/$defs/workflow" },
        "follows": { "description": "Nodes whose outputs this node receives.", "type": "array", "items": { "type": "string", "minLength": 1 } },
        "followed_by": { "description": "The same edges written from the other end.", "type": "array", "items": { "type": "string", "minLength": 1 } },
        "verify": { "description": "A tool in tools run on the node's output; findings re-fire the node.", "type": "string", "minLength": 1 },
        "retries": { "description": "How many times verify findings re-fire the node.", "type": "integer", "minimum": 0, "default": 2 },
        "skip_when_verified": { "description": "A node in this node's follows. When that node's result was accepted by an authoritative verifier, this node does not fire and contributes that node's value instead. The named node must declare verify, or a model program whose done_when.verify is declared.", "type": "string", "minLength": 1 },
        "branches": {
          "description": "Label to the successors that fire when the node's value names that label in its branch field.",
          "type": "object",
          "additionalProperties": { "type": "array", "items": { "type": "string", "minLength": 1 } }
        },
        "max_fires": { "description": "How many times the node may fire in one episode; required on a cycle, and summed into the graph's possible firings.", "type": "integer", "minimum": 1, "default": 1 },
        "terminal": { "description": "Completing this node completes the workflow.", "type": "boolean", "default": false },
        "empty": { "description": "The value the node contributes when recovery skips it; without it, skip is not offered." },
        "recovery": {
          "type": "object",
          "additionalProperties": false,
          "properties": {
            "follows": { "description": "Further nodes whose outputs the node's recovery decision sees.", "type": "array", "items": { "type": "string", "minLength": 1 } }
          }
        }
      }
    }
  }
}
