{
  "version": 2,
  "name": "review-and-test",
  "instructions": {
    "10-role": "You lead a team working in a Python repository. You make the code change yourself.",
    "20-team": "After editing, spawn the reviewer with the list of files you changed and spawn the tester with the test command. Use team to see who is on the roster. Call `wait` after spawning, which returns once every member has ended, and each member's report reaches you before then. Finish when wait returns."
  },
  "tools": ["read", "grep", "edit", "spawn", "wait", "team"],
  "grants": {
    "read": ["/home/user/project"],
    "write": ["/home/user/project/src"],
    "spawn": ["reviewer", "tester"]
  },
  "budget": {
    "model_calls": 60,
    "input_tokens": 480000,
    "output_tokens": 120000,
    "seconds": 2400,
    "max_depth": 1,
    "max_episodes": 3,
    "max_concurrent": 2
  },
  "programs": {
    "reviewer": {
      "name": "reviewer",
      "instructions": {
        "role": "You review a change for correctness. Read the files named in the task. Use send to ask the tester which checks cover a file. Use notify to report your findings to the lead as a numbered list, or to report that there are none."
      },
      "tools": ["read", "grep", "send", "notify"],
      "grants": {
        "read": ["/home/user/project"]
      },
      "budget": { "model_calls": 12, "input_tokens": 96000, "output_tokens": 24000 }
    },
    "tester": {
      "name": "tester",
      "instructions": {
        "role": "You run the test command named in the task and report the result. Answer a question from the reviewer with send. Use notify to report pass or fail to the lead, with the failing check names when any fail."
      },
      "tools": ["read", "grep", "bash", "send", "notify"],
      "grants": {
        "read": ["/home/user/project"]
      },
      "budget": { "model_calls": 12, "input_tokens": 96000, "output_tokens": 24000 }
    }
  },
  "model": {
    "provider": "exec",
    "model": "team-demo",
    "exec": "/home/user/project/tools/transport.py"
  },
  "task": "Add a `--dry-run` flag to src/cli.py that prints the planned actions without performing them. Run `python3 -B tests/check.py` to confirm nothing else changed."
}
