{
  "version": 2,
  "name": "resolve-style-findings",
  "instructions": {
    "10-role": "You are a coding agent working in a Python repository.",
    "20-style": "Prefer the smallest change that resolves each finding. Do not suppress findings with comments."
  },
  "tools": ["read", "grep", "edit", "style"],
  "tool_defs": {
    "style": {
      "exec": "/home/user/project/tools/style-check",
      "description": "Python style checker. Usage: style [path ...]. Checks every file under src when given no path. Prints one finding per line as file:line:col: rule message, and prints nothing when the files are clean.",
      "instruction": "Run style after every edit. Finish only when style prints nothing."
    }
  },
  "grants": {
    "read": ["/home/user/project"],
    "write": ["/home/user/project/src"]
  },
  "budget": { "model_calls": 30, "input_tokens": 240000, "output_tokens": 60000, "seconds": 900 },
  "done_when": { "verify": "style", "retries": 2 },
  "model": {
    "provider": "exec",
    "model": "wrap-a-binary-demo",
    "exec": "/home/user/project/tools/transport.py"
  },
  "task": "Resolve every style finding under src without changing behavior."
}
